{
  "schema_version": "kb.v1",
  "ok": true,
  "data": {
    "text": "[03_Resources/retention.md:11-14 sha256:885a82712759b2f400a42c013d4e225eb35af990e39558f8edc07af0e8e126dc]\n# Synthetic retention\n\nThe recorded retention interval is 600 seconds, according to the [synthetic policy revision](retention-source.md).\n[03_Resources/retention-source.md:11-16 sha256:69ce500902ba1f6be1545deea6b71582d2263be256248cec80e3a3bc3c563727]\n# Synthetic retention policy revision\n\nThe supplied immutable snapshot `new-source.md` states that the retention interval for the example service is 600 seconds. This is controlled test evidence.\n\nSnapshot SHA-256: `681e66fa478c73bf5d73ebfd5a2acd71b3738c19d2af2a9fa4ff23427ccda08e`.\n[03_Resources/service-decision.md:11-14 sha256:c183c68e7b39c37ba05315e7a7234cfb20d3f5e9ce3073876c3d5238bca4a1b6]\n# Synthetic retention\n\nThe recorded retention interval is 600 seconds, according to the [synthetic policy revision](retention-source.md).\n",
    "sources": [
      {
        "path": "03_Resources/retention.md",
        "revision": "sha256:885a82712759b2f400a42c013d4e225eb35af990e39558f8edc07af0e8e126dc",
        "heading": "Synthetic retention",
        "line_start": 11,
        "line_end": 14
      },
      {
        "path": "03_Resources/retention-source.md",
        "revision": "sha256:69ce500902ba1f6be1545deea6b71582d2263be256248cec80e3a3bc3c563727",
        "heading": "Synthetic retention policy revision",
        "line_start": 11,
        "line_end": 16
      },
      {
        "path": "03_Resources/service-decision.md",
        "revision": "sha256:c183c68e7b39c37ba05315e7a7234cfb20d3f5e9ce3073876c3d5238bca4a1b6",
        "heading": "Synthetic retention",
        "line_start": 11,
        "line_end": 14
      }
    ],
    "estimated_tokens": 223,
    "estimator": "utf8-bytes/4-ceiling",
    "truncated": false,
    "omitted": 0,
    "generation": "sha256:ac3aebffd30c006a5aab409f9df5b6fa2db77bad994ebd1301ea9e9bbc86b657"
  },
  "warnings": [],
  "meta": {
    "root": "<external-knowledge>",
    "generation": "sha256:ac3aebffd30c006a5aab409f9df5b6fa2db77bad994ebd1301ea9e9bbc86b657",
    "index_stale": true
  }
}
